<?xml version="1.0" encoding="UTF-8" ?>
<class name="TileMap" inherits="Node2D" xmlns:xsi="http://www.w3.org/2001/XMLSchema-instance" xsi:noNamespaceSchemaLocation="../class.xsd">
	<brief_description>
		Node for 2D tile-based maps.
	</brief_description>
	<description>
		Node for 2D tile-based maps. Tilemaps use a [TileSet] which contain a list of tiles which are used to create grid-based maps. A TileMap may have several layers, layouting tiles on top of each other.
		For performance reasons, all TileMap updates are batched at the end of a frame. Notably, this means that scene tiles from a [TileSetScenesCollectionSource] may be initialized after their parent.
		To force an update earlier on, call [method update_internals].
	</description>
	<tutorials>
		<link title="Using Tilemaps">$DOCS_URL/tutorials/2d/using_tilemaps.html</link>
		<link title="2D Platformer Demo">https://godotengine.org/asset-library/asset/120</link>
		<link title="2D Isometric Demo">https://godotengine.org/asset-library/asset/112</link>
		<link title="2D Hexagonal Demo">https://godotengine.org/asset-library/asset/111</link>
		<link title="2D Navigation Astar Demo">https://godotengine.org/asset-library/asset/519</link>
		<link title="2D Role Playing Game Demo">https://godotengine.org/asset-library/asset/520</link>
		<link title="2D Kinematic Character Demo">https://godotengine.org/asset-library/asset/113</link>
	</tutorials>
	<methods>
		<method name="_tile_data_runtime_update" qualifiers="virtual">
			<return type="void" />
			<param index="0" name="layer" type="int" />
			<param index="1" name="coords" type="Vector2i" />
			<param index="2" name="tile_data" type="TileData" />
			<description>
				Called with a TileData object about to be used internally by the TileMap, allowing its modification at runtime.
				This method is only called if [method _use_tile_data_runtime_update] is implemented and returns [code]true[/code] for the given tile [param coords] and [param layer].
				[b]Warning:[/b] The [param tile_data] object's sub-resources are the same as the one in the TileSet. Modifying them might impact the whole TileSet. Instead, make sure to duplicate those resources.
				[b]Note:[/b] If the properties of [param tile_data] object should change over time, use [method notify_runtime_tile_data_update] to notify the TileMap it needs an update.
			</description>
		</method>
		<method name="_use_tile_data_runtime_update" qualifiers="virtual">
			<return type="bool" />
			<param index="0" name="layer" type="int" />
			<param index="1" name="coords" type="Vector2i" />
			<description>
				Should return [code]true[/code] if the tile at coordinates [param coords] on layer [param layer] requires a runtime update.
				[b]Warning:[/b] Make sure this function only return [code]true[/code] when needed. Any tile processed at runtime without a need for it will imply a significant performance penalty.
				[b]Note:[/b] If the result of this function should changed, use [method notify_runtime_tile_data_update] to notify the TileMap it needs an update.
			</description>
		</method>
		<method name="add_layer">
			<return type="void" />
			<param index="0" name="to_position" type="int" />
			<description>
				Adds a layer at the given position [param to_position] in the array. If [param to_position] is negative, the position is counted from the end, with [code]-1[/code] adding the layer at the end of the array.
			</description>
		</method>
		<method name="clear">
			<return type="void" />
			<description>
				Clears all cells.
			</description>
		</method>
		<method name="clear_layer">
			<return type="void" />
			<param index="0" name="layer" type="int" />
			<description>
				Clears all cells on the given layer.
				If [param layer] is negative, the layers are accessed from the last one.
			</description>
		</method>
		<method name="erase_cell">
			<return type="void" />
			<param index="0" name="layer" type="int" />
			<param index="1" name="coords" type="Vector2i" />
			<description>
				Erases the cell on layer [param layer] at coordinates [param coords].
				If [param layer] is negative, the layers are accessed from the last one.
			</description>
		</method>
		<method name="fix_invalid_tiles">
			<return type="void" />
			<description>
				Clears cells that do not exist in the tileset.
			</description>
		</method>
		<method name="force_update" is_deprecated="true">
			<return type="void" />
			<param index="0" name="layer" type="int" default="-1" />
			<description>
				[i]Deprecated.[/i] See [method notify_runtime_tile_data_update] and [method update_internals].
			</description>
		</method>
		<method name="get_body_rid_for_coords" extension_source="bloom">
			<return type="RID" />
			<param index="0" name="layer" type="int" />
			<param index="1" name="coords" type="Vector2i" />
			<description>
				Returns a body [RID] associated with the given cell.
			</description>
		</method>
		<method name="get_cell_alternative_tile" qualifiers="const">
			<return type="int" />
			<param index="0" name="layer" type="int" />
			<param index="1" name="coords" type="Vector2i" />
			<param index="2" name="use_proxies" type="bool" default="false" />
			<description>
				Returns the tile alternative ID of the cell on layer [param layer] at [param coords]. If [param use_proxies] is [code]false[/code], ignores the [TileSet]'s tile proxies, returning the raw alternative identifier. See [method TileSet.map_tile_proxy].
				If [param layer] is negative, the layers are accessed from the last one.
			</description>
		</method>
		<method name="get_cell_atlas_coords" qualifiers="const">
			<return type="Vector2i" />
			<param index="0" name="layer" type="int" />
			<param index="1" name="coords" type="Vector2i" />
			<param index="2" name="use_proxies" type="bool" default="false" />
			<description>
				Returns the tile atlas coordinates ID of the cell on layer [param layer] at coordinates [param coords]. If [param use_proxies] is [code]false[/code], ignores the [TileSet]'s tile proxies, returning the raw alternative identifier. See [method TileSet.map_tile_proxy].
				If [param layer] is negative, the layers are accessed from the last one.
			</description>
		</method>
		<method name="get_cell_source_id" qualifiers="const">
			<return type="int" />
			<param index="0" name="layer" type="int" />
			<param index="1" name="coords" type="Vector2i" />
			<param index="2" name="use_proxies" type="bool" default="false" />
			<description>
				Returns the tile source ID of the cell on layer [param layer] at coordinates [param coords]. Returns [code]-1[/code] if the cell does not exist.
				If [param use_proxies] is [code]false[/code], ignores the [TileSet]'s tile proxies, returning the raw alternative identifier. See [method TileSet.map_tile_proxy].
				If [param layer] is negative, the layers are accessed from the last one.
			</description>
		</method>
		<method name="get_cell_tile_data" qualifiers="const">
			<return type="TileData" />
			<param index="0" name="layer" type="int" />
			<param index="1" name="coords" type="Vector2i" />
			<param index="2" name="use_proxies" type="bool" default="false" />
			<description>
				Returns the [TileData] object associated with the given cell, or [code]null[/code] if the cell does not exist or is not a [TileSetAtlasSource].
				If [param layer] is negative, the layers are accessed from the last one.
				If [param use_proxies] is [code]false[/code], ignores the [TileSet]'s tile proxies, returning the raw alternative identifier. See [method TileSet.map_tile_proxy].
				[codeblock]
				func get_clicked_tile_power():
				    var clicked_cell = tile_map.local_to_map(tile_map.get_local_mouse_position())
				    var data = tile_map.get_cell_tile_data(0, clicked_cell)
				    if data:
				        return data.get_custom_data("power")
				    else:
				        return 0
				[/codeblock]
			</description>
		</method>
		<method name="get_coords_for_body_rid">
			<return type="Vector2i" />
			<param index="0" name="body" type="RID" />
			<description>
				Returns the coordinates of the tile for given physics body RID. Such RID can be retrieved from [method KinematicCollision2D.get_collider_rid], when colliding with a tile.
			</description>
		</method>
		<method name="get_layer_for_body_rid">
			<return type="int" />
			<param index="0" name="body" type="RID" />
			<description>
				Returns the tilemap layer of the tile for given physics body RID. Such RID can be retrieved from [method KinematicCollision2D.get_collider_rid], when colliding with a tile.
			</description>
		</method>
		<method name="get_layer_modulate" qualifiers="const">
			<return type="Color" />
			<param index="0" name="layer" type="int" />
			<description>
				Returns a TileMap layer's modulate.
				If [param layer] is negative, the layers are accessed from the last one.
			</description>
		</method>
		<method name="get_layer_name" qualifiers="const">
			<return type="String" />
			<param index="0" name="layer" type="int" />
			<description>
				Returns a TileMap layer's name.
				If [param layer] is negative, the layers are accessed from the last one.
			</description>
		</method>
		<method name="get_layer_navigation_map" qualifiers="const">
			<return type="RID" />
			<param index="0" name="layer" type="int" />
			<description>
				Returns the [NavigationServer2D] navigation map [RID] currently assigned to the specified TileMap [param layer].
				By default the TileMap uses the default [World2D] navigation map for the first TileMap layer. For each additional TileMap layer a new navigation map is created for the additional layer.
				In order to make [NavigationAgent2D] switch between TileMap layer navigation maps use [method NavigationAgent2D.set_navigation_map] with the navigation map received from [method get_layer_navigation_map].
				If [param layer] is negative, the layers are accessed from the last one.
			</description>
		</method>